company,id,number_of_board_memebers,average_age_board,executives,total_active_assignments,total_prev_assignments,companies
Ripman Design AB,5590406046,2,69,Gerger; Bengt Patrik,3,15,Lexsol AB|Ripman Design AB|Bostadsrättsföreningen Kv Navaren; Industristaden AR
Kåbo Bygg & Hantverk AB,5590206628,2,30,Vahanyan; Artur,1,0,Kåbo Bygg & Hantverk AB
CGDS Invest AB,5591955199,3,64,Schullström; Håkan Hans Tage,6,4,NorCare Living Quality AB|EMS VacParts AB|Larome Breed Handelsbolag|EMS-Företagshus AB|HMS Contrade AB|CGDS Invest AB
CGDS Invest AB,5591955199,3,64,Schullström; Carl Gustav Daniel,2,3,CGDS Invest AB|Larome Breed Handelsbolag
Sommaridyll AB,5590213582,2,50,Svanqvist; Henrik Nils Anders,6,31,TMPL Solutions AB|Fastighetsbolaget Bol 3:14 AB|Green Bridge Development AB|Tmpl Work AB|Rosendal Bostäder D AB|Sommaridyll AB
Stark Mark i Sverige AB,5567690911,2,51,Ohlsson; Kenneth Gustav Denniz,4,11,Sten-Vid Aktiebolag|Birkaporten AB|Kenceo AB|Stark Mark i Sverige AB
Derome Hus AB,5562509223,5,50,Mossbrant; Peter Karl,110,164,Derome Aktiebolag|Derome Byggvaror & Träteknik Aktiebolag|Derome Timber Aktiebolag|Derome Skog Aktiebolag|Derome Hus AB|Derome Husproduktion AB|IMAB Hallands Industrimaterial Aktiebolag|Derome Förvaltning Holding AB|Nässjö Takstolsfabrik AB|Derome Byggvaror Alvesta AB|B M S i Hässleholm Aktiebolag|Svensk Bygglogistik AB|Älvsåker Fastighetsförvaltning                    Aktiebolag|Derome Hyresfastigheter AB|Derome Moheda Järnhandel AB|Derome Fastighet AB|Varbergshägern Fastighets AB|Kjells Arbetskläder & Verktyg AB|Derome Bygg-& Industrivaror Gislaved AB|Madbo Fastighetsförvaltning AB|DBT Fastigheter AB|Pinnån Fastighetsförvaltning Aktiebolag|Granhall 9293 Fast 1 AB|DBT Fastigheter Syd AB|Getskär Fastighets AB|SEBACA Fastighets AB|MAX Förvaltnings AB|Hyllinge Parkby AB|Kilugglan Aktiebolag|Södra Näs Fastighetsförvaltning Aktiebolag|DBT Fastigheter Landskrona AB|Snöstorp Fastighets AB|Dressin Fastighet AB|Halmstad Fastighetsutveckling AB|DHP Fastigheter Kristinehamn AB|Vabränna Fastighets AB|Fastighets AB Maja|Logistikpatrullen AB|Derome Vindkraft AB|Pronord Aktiebolag|LJA Real Estate AB|Derome Mälardalen Fastighet AB|ÖstraLång AB|Aktiebolaget Maa Såg|Snidaren 14 AB|Ullarpstomter AB|Spånan Fastighetsförvaltning Aktiebolag|Järngeten AB|Hammarsmedsgatan Fastighets AB|Charleshill Fastighet AB|Kinnared Skog Aktiebolag|Hajland Fastighetsaktiebolag|Åsby Handel AB|Derome Skogsfastighet AB|Granhall 93 Fast AB|Stadsskogsparken Fastighets AB|Gunnilse Centrum Aktiebolag|Havskanten 3 AB|Bro Mälarstrand 21 AB|Bro Mälarstrand 23 AB|Mark & Försäkringspartner i Halland AB|Sjölärkan Bostad AB|Ideella föreningen Varbergs Fastighetsägare-      förening med firma Föreningen Fastighetsägarna|Tattarkullen Fastighets AB|Frillesås Fastighets AB|Bike Fastighetsförvaltning AB|Granhall 9327 AB|Granhall 9342 AB|Fastighetsbolaget Silkesvägen AB|Granhall 93 AB|Granblad 20 AB|Kungsgranen 19 AB|Granhall 9293 Fast 2 AB|Derome JVHM AB|Fridbo Fastighetsförvaltning AB|Granbarr 115 Fast 3 AB|Bro Mälarstrand 27 AB|Charleshill Svarttall AB|Högmora Exploatering 2 AB|Derome Takstolar AB|Derome Charleshill Fastighet AB|Derome & Peritum Bro 2 AB|Granhall Rulta fyra AB|Derome Hus Holding 25 AB|Fastighetsbolaget Forsa Gård AB|Sjölärkan Holding AB|Granskott 9370 AB|Mariefredaren AB|KAJB i Falkenberg AB|Dressin Fastighetsinvest AB|Anchora Invest AB|Kungsgranen 19 Fast 2 AB|Derome & Peritum Utveckling Täljöviken 2 AB|Derome Hold JV AB|BoMalmen i Varberg AB|D&P JV Fyra Proc AB|Granhall 9293 Fast 3 AB|Hede Fast 2 AB|Granbarr 115 Fast 2 AB|Hede Fast 1 AB|Kungsgranen 20 AB|Granhall 9293 AB|Kungsgranen 20 Fast 1 AB|Kungsgranen 20 Fast 3 AB|Derome JVM AB|Derome & Peritum Bro 1 AB|Bro Mälarstrand 25 AB|Granbarr 115 Fast 1 AB|Derome Maskinuthyrning AB|Drottninggranen AB
Hancap AB (publ),5567897144,3,46,Blomquist; Roger,8,22,Hancap AB (publ)|SeaWing PBB AB|Kan Fönster Sverige AB|Helge Jung Fastighets AB|Rehact AB|CreMed AB|Massive Management AB|IEFAG International Entrance and Facade Group AB
MTA Bygg & Anläggning Halland AB,5567944847,4,52,Granberg; Claes Andreas,30,25,MACNAT Holding AB|MTA Bygg & Anläggning Halland AB|MTA Bygg & Anläggning Skåne AB|MTA Maskin AB|Halmstad Vårdboende AB|MTA Bygg & Anläggning i Varberg AB|Kävlinge Vårdboende AB|Eirhem AB|Båstad Tuvelyckan AB|Båstadlyckan Fastighets AB|Båstads Communicationscenter AB|Trelleborg Vårdboende AB|MTAF nr 15 AB|Varberg Vårdboende AB|Midhem Projektutveckling AB|Varberg Trygghetsbostäder AB|MTAF nr 30 AB|MTAF nr 20 AB|MACNAT Construction AB|Expressgrus i Halmstad AB|MTAF nr 31 AB|MTAF nr 12 AB|MTAF nr 32 AB|MACNAT Property Development AB|Mölnlycke Vårdboende AB|MatsTommyAndreas Fastighets AB|MACNAT Property AB|Båstad Vårdboende AB|Falkenberg Vårdboende AB|MTA Trollängen Holding AB
Peterson & Hansson Byggnads AB,5560891839,6,55,Nilsson; Gert Tony,8,3,Peterson & Hansson Byggnads AB|Peterson & Hansson Holding AB|Frenova El AB|B.K. 1101 Invest AB|Dinens AB|Onatopp in west AB|Falkenberg Murarelyckan 1:1 AB|STUF AB
AF Bygg Syd AB,5561789313,4,48,Persson; Karl Anders Roger,1,16,AF Bygg Syd AB
Tage & Söner i Varberg AB,5561582536,4,62,Strömberg; Erik Stefan,2,2,Tage & Söner Byggnads AB|Tage & Söner i Varberg AB
Tage & Söner i Varberg AB,5561582536,4,62,Andersson; Johan Fredrik,32,5,Tage & Söner Förvaltnings AB|Tage & Söner i Varberg AB|Tage & Söner Byggnads AB|Tage & Söners Industrientreprenad AB|Hylte Svets Aktiebolag|Keba Sweden AB|T&S Uthyrningsmaskiner AB|T&S Åtterås 19:126 AB|T&S Hjulet 7 AB|Tage & Söner Vagnen AB|T&S Freddy AB|T&S Ängsdal 5 AB|T & S Smeden Fastighets AB|T&S Åtterås 19:101 AB|T&S Cylindervägen 15 AB|T&S Ängsdal 6 AB|T&S Hässlehult AB|Bostads AB Nissan|T&S Eketånga AB|T&S Staffansbo AB|T & S Kungsäter AB|T&S Hyreshus AB|T & S Träslövsläge Fastigheter AB|T&S Nygård AB|T&S Storgatan AB|Filijox Design AB|T&S Hjulet 7 Holding AB|T&S Fastighetsförvaltning AB|T&S Exploateringsfastigheter AB|T&S Driftsfastigheter AB|T&S Hyreshus Holding AB|T & S Falkenbäck AB
Aranäs Projekt AB,5567191423,5,56,Pettersson; Björn Nenne,23,1,Aranäs Projekt AB|Aranäs Kolla Parkstad AB|Aranäs Onsalamotet AB|Aranäs Tölö AB|Aranäs AB|Aranäs Valand AB|Monika Mulder Design AB|Aranäs Parkering AB|Aranäs i Kungsbacka 17 AB|Kungsmässan AB|Aranäs i Kungsbacka 22 AB|Aranäs i Kungsbacka 13 AB|Aranäs i Kungsbacka 12 AB|Aranäs i Kungsbacka 18 AB|Aranäs i Kungsbacka 21 AB|Aranäs i Kungsbacka 20 AB|Aranäs i Kungsbacka 23 AB|Aranäs Förvaltning AB|Aranäs i Kungsbacka 24 AB|Aranäs i Kungsbacka 14 AB|Aranäs Varlaberg AB|Aranäs Fastigheter AB|Aranäs i Kungsbacka 15 AB
Aktiebolaget Oscar Hanson Värme - Ventilation -   Sanitet,5560415480,4,56,Hanson; Oscar Ruben,5,3,Aktiebolaget Oscar Hanson Värme - Ventilation -   Sanitet|Fastighets AB Filaren 3|Fastighets AB Filaren 5|Nosnah Invest AB|Nosnah Fastighets AB
Olof Mobjer Entreprenad Aktiebolag,5564451275,3,56,Bergendal; Lars Magnus,3,40,Olof Mobjer Entreprenad Aktiebolag|Fjällvärme i Sälen AB|G; Nilssons Last & Planering i                    Ranseröd Aktiebolag
Karlsson & Svensson Projekt AB,5565695888,3,54,Opseth; Ove Ingemar,7,23,Norco Spectra Invest AB|Karlsson & Svensson Projekt AB|Norcospectra AB|CnO Consulting AB|Elektronik Teknik Mekanik 4U Sverige AB|Fågelsundets Fiskeläge Ekonomisk förening|Karlsson & Svensson Holding AB
S-K Bygg AB,5566975271,3,61,Svensson; Per Christian,12,9,SK Bygg Förvaltning AB|S-K Bygg AB|Fölabacken Förvaltning AB|Nya Fjällalunda Gård AB|Rönnhagens Fastighets AB|Förenade fastigheter i Hjortsberg AB|Förenade Fastigheter Fredstiden AB|SK BYGG FASTIGHETER I FALKENBERG AB|Förenade Fastigheter Fredsfalken AB|Boliljan AB|Bopassaren AB|Förenade fastigheter i Falkenberg AB
Kungsbacka Byggnads AB,5565669636,6,53,Aronsson; Dan Carl-Hugo,2,5,DAN HOLDING AB|Kungsbacka Byggnads AB
Elektro-Emanuel AB,5565369138,7,49,Emanuelsson; Sven Anders,2,6,Elektro-Emanuel AB|Maria Emanuelsson AB
Aderbys Rör AB,5562729714,6,57,Molander; Sven Anders,1,5,Aderbys Rör AB
Falkenbergs Rör Aktiebolag,5560773797,3,47,Dahl; Johan Martin,3,5,Falkenbergs Rör Aktiebolag|MMJ Utvecklings AB|Intressentföreningen Reko Comfort Ek. för.
Brion Rör AB,5591065452,4,46,Karlsson; Helge Lennart,5,4,Brion Invest AB|Brion Rör AB|Brion Ventilation AB|Brion Teknik AB|Brion VS Skåne AB
Etikhus AB,5565377883,3,49,Arnesten; Anna Helena,1,1,Etikhus AB
Bygg Aktiebolag Lars Bengtsson & Son,5564567336,3,52,Eriksson; Bengt Johan Magnus,11,6,Bygg Aktiebolag Lars Bengtsson & Son|Holding AB Lars Bengtsson & son|Skummeslövs Fastighetsbolag AB|POJJEN AB|Bengtsson & Eriksson i Veinge AB|Acler Förvaltning AB|Förvaltnings AB Lars Bengtsson & son|BJM Invest AB|BJM Förvaltning AB|Acmer Förvaltning AB|Acer Förvaltning AB
Peter Bengtsson Bygg i Falkenberg AB,5568936107,4,51,Börjesson; Bo Göran,9,20,Peter Bengtsson Bygg i Falkenberg AB|Östervång Projekt AB|STS Hallen AB|Åbron Hus AB|AB Åbacken 102|Bostadsrättsföreningen Trädgårdsstaden 2 i        Trelleborg|BBLB Holding i Falkenberg AB|Bostadsrättsföreningen Trädgårdsstaden 3 i        Trelleborg|Östervång Holding AB
El Aktiebolaget Johansson och Sparf,5562186899,3,42,Ragneman; Paul Anders,4,5,Ragneman Förvaltning AB|El Aktiebolaget Johansson och Sparf|Slöinge Elektriska AB|Ragneman Fastighets AB
El Aktiebolaget Johansson och Sparf,5562186899,3,42,Florén; Kim Göran,2,5,El Aktiebolaget Johansson och Sparf|Slöinge Elektriska AB
Teodoliten Mätteknik AB,5563617280,3,44,Öryd; Lars Anders,2,0,Teodoliten Mätteknik AB|Teodoliten Förvaltning AB
Turessons Bygg i Varberg AB,5567103337,4,45,Turesson; Kurt Roland,12,9,Turessons Bygg i Varberg AB|Varbergskaninen Projekt AB|Hästhagaporten Fastighets AB|Takryttaren Fastighets AB|Takryttaren Projekt AB|Ketoro Holding AB|Hästhagaporten Holding AB|Varbergskaninen Invest AB|Takryttaren Holding AB|Stålgatans Förvaltning AB|Roland Turesson AB|Bostadsrättsföreningen Bålverket
Markteknik Sverige AB,5565744546,3,56,Karlsson; Kent Roger,4,2,Markteknik Sverige AB|Allschakt Miljö Varberg AB|Bergkraft Fastighet AB|BERGKRAFT SVERIGE AB
Halmstads Drivmedelsteknik Aktiebolag,5563641132,4,61,Aronsson; Peter Johnny Mikael,3,1,asurmer AB|Halmstads Drivmedelsteknik Aktiebolag|Compromix AB
Anker AB,5566030549,3,53,Olsson; Dan Kenneth,1,7,Anker AB
Aktiebolaget Halmstad Kylteknik,5565793006,4,54,Olsson; Jan Henrik,8,6,Aktiebolaget Halmstad Kylteknik|Kyl-Consult i Halmstad Aktiebolag|Henrik Olsson Förvaltnings AB|Fastighetsbolaget Furuviksringen 30 AB|SWEBAC Aktiebolag|Bra ideer Sverige AB|God Utväxling AB|Toppskiktet Holding AB
Vertiseit AB (publ),5567535272,6,47,Lagerqvist; Jonas Kristoffer,12,6,Vertiseit AB (publ)|DISE International AB|Digital Signage Solutions Sweden AB|InStoreMedia AB|FGB Fastighets AB|Kristin Lagerqvist AB|Ferrum Förvaltnings AB|Kohagen AB|Ferrum Viskastigen AB|Subbe Fyr AB|Ferrum Veddige AB|Ferrum AB
Vertiseit AB (publ),5567535272,6,47,Lind; Johan Tobias,4,13,Vertiseit AB (publ)|DISE International AB|Digital Signage Solutions Sweden AB|InStoreMedia AB
Kenneths Bygg Aktiebolag,5564054319,2,38,Johansson; Lars Johan Marcus,4,0,Kenneths Bygg Aktiebolag|Skravelsbo Ettan AB|Marcus Johansson Holding AB|Sjökanten AB
Brion Ventilation AB,5591094718,4,48,Engström; Olov Niclas,1,1,Brion Ventilation AB
Harry Larssons Bygg Falkenberg AB,5566654124,3,49,Pettersson; Helen Annelie,3,4,A Pettersson Glommen Holding AB|Harry Larssons Bygg Falkenberg AB|TAF Holding AB
Hallands Vent & Plåtentreprenader Aktiebolag,5565051173,3,65,Andersson; Peter Mikael,6,5,Hallands Vent & Plåtentreprenader Aktiebolag|PV Företagen Service AB|HYBE Maskin AB|Kustens VVS AB|El & Larmtjänst i Halmstad AB|Sydkonstruktion AB
Jord & Berg i Kungsbacka AB,5565543138,4,55,Daun; Robert Anders Erik,1,0,Jord & Berg i Kungsbacka AB
Tofta Bygg AB,5563817880,3,67,Bengtsson; Claes Anders,35,26,Tofta Bygg AB|Hisingens Mark & Trädgård AB|Varlaberg Förvaltning AB|Höör Hotell och Konferens AB|Klousten Fastighets AB|Hallagårdens Stugby AB|Bengtsson & Zetterholms Fastigheter AB|Golvvårdskonsulten i Göteborg AB|Kungsbacka Business Center AB|Fastighetsutveckling i Åsa AB|Fastighetsutveckling i Åsa Stationsväg AB|Centrumhuset i Åsa AB|Svedjegården AB|Lönndörren i Göteborg AB|Hotel Investments Group Holding Sweden AB|Onsala Gårdar AB|Blackstone AB|Magnific Design i Göteborg AB|Sintorp Fastigheter AB|Gagnant AB|Åsa Stationsväg 2 Exploaterings AB|Alliora Care AB|Tofta Holding AB|Stråvalla Exploatering AB|Tofta Invest AB|Natural Stone Agency Scandinavia AB|Skäretvägen Äppelbo Fastigheter AB|Varlaberg Fastigheter AB|Katarinas Serviceteam AB|Toftagläntans Hyreshus AB|Bostadsrättsföreningen Styrsö - Ekudden|Ekudden i Styrsö AB|Tofta Holding 2 AB|Bostadsrättsföreningen Äppelbo Havsnära|Fastighets AB Stråvalla II
Viavest Maskin AB,5567106629,6,50,Hansson; Lars Henrik,18,19,Kungsbacka Lastbilcentral AB|VIAVEST AB|Västkustens Mark & Asfalt AB|Strand i Jönköping AB|Tjällmo Grävmaskiner Aktiebolag|Viavest Maskin AB|Tångabergs Schakt Aktiebolag|SweGrund Aktiebolag|Thyras Aktiebolag|Lerjedalen Markberedning AB|Sten & Markteknik i Jönköping AB|Kungsbacka Lastbilcentral Fastighets              Aktiebolag|Transportcentrum i Kungsbacka AB|Kandinen AB|Viavest Miljö AB|Kungsbacka Lastbilscentral Ekonomisk förening|SMA Infrastruktur AB|Kungsbacka Mölndal Holding AB
Ventilationsteknik i Kungsbacka AB,5562296136,5,48,Sällkvist; Fredrik Jonny,1,0,Ventilationsteknik i Kungsbacka AB
Runevads VVS Teknik Aktiebolag,5566342563,5,46,Runevad; Bengt Fredrik,4,2,Runevads VVS Teknik Aktiebolag|VVS & Hyr i Varberg AB|FK i Varberg AB|SARSS Holding AB
Miljöschakt Väst AB,5590088919,3,50,Asklöf; Karl Martin,4,0,Miljöschakt Väst AB|Asklöf Holding AB|K.Asklöf Holding AB|M.Asklöf Holding AB
Sandå Halmstad AB,5565860367,3,58,Lindelöf; Johan Åke Einar,2,0,JFM Fastigheter AB|Sandå Halmstad AB
Tångabergs Schakt Aktiebolag,5560765629,4,51,Johansson; Bengt Jörgen,2,2,Blästergatans Fastighets AB|Tångabergs Schakt Aktiebolag
SweGrund Aktiebolag,5563179935,4,50,Morän; Kjell Fredrik,2,0,SweGrund Aktiebolag|Hittarps RK drifts AB
Vestkust Entreprenad AB,5590180120,3,34,Scott; Gustav Christian,1,0,Vestkust Entreprenad AB
RA Golv AB,5563677151,5,52,Lindgren; Rolf Christer Yngve,3,15,RA Golv AB|Call Fastigheter AB|RA Golv Holding AB
Stråvalla Maskinstation Aktiebolag,5562576313,2,59,Johansson; Sven Olof Ingmar,3,2,SL Entreprenad i Väst AB|Stråvalla Markmiljö AB|Stråvalla Maskinstation Aktiebolag
Varbergs Schakt AB,5564636842,5,54,Serholt; Mats John Roger,2,4,Himle Svets & Mekaniska AB|Varbergs Schakt AB
Aktiebolaget Micropol Fiberoptic,5564700499,7,51,Ljungkvist; Peter Richard,3,0,Micropol Fiberoptic Holding AB|Aktiebolaget Micropol Fiberoptic|Ljungkvist & Partners AB
VOTAB VVS & Värmeinstallation AB,5561383422,3,49,Gustafsson; Erik Linus,4,1,VOTAB VVS & Värmeinstallation AB|Fastighetsförvaltning Karossen i Varberg AB|EG 86 Holding AB|Västkustens Isolering & Plåt AB
Fredblad Arkitekter Aktiebolag,5565005492,7,53,Jönsson; Stig Leif,4,5,Fredblad Arkitekter Aktiebolag|Halmstad Golf Arena AB|Fredblad Arkitekter Intressenter AB|Elva i Halmstad AB
Lerbergs Entreprenad AB,5565955944,2,53,Berntsson; Tommy Sigvard,8,5,Kungsbacka Lastbilcentral AB|VIAVEST AB|Viavest Maskin AB|Lerbergs Entreprenad AB|SL Entreprenad i Väst AB|Kungsbacka Lastbilcentral Fastighets              Aktiebolag|Transportcentrum i Kungsbacka AB|Kungsbacka Lastbilscentral Ekonomisk förening
Slöinge Elektriska AB,5567142988,3,42,Ragneman; Paul Anders,4,5,Ragneman Förvaltning AB|El Aktiebolaget Johansson och Sparf|Slöinge Elektriska AB|Ragneman Fastighets AB
Slöinge Elektriska AB,5567142988,3,42,Flor‚n; Kim Göran,2,5,El Aktiebolaget Johansson och Sparf|Slöinge Elektriska AB
Sandéns Golv i Halmstad AB,5591278428,4,45,Hansson; Magnus,4,4,Sandéns Golv i Ängelholm AB|Sandéns Golv i Halmstad AB|Etagon AB|SH Design och Bygg AB
Svenska Connected Wind Services AB,5567385009,3,50,Sjölin; Torbjörn Kurt Anders,2,13,EnBW Sverige AB|Svenska Connected Wind Services AB
Kungsbacka Tak & Bygg AB,5568634116,2,47,Sopp; Brian William,7,13,Grundia AB|Kungsbacka Tak & Bygg AB|Gottskärs Plåtslageri AB|Cairy AB|Djingis & Ninja Turnaround Management AB|Grundia Fastigheter AB|Kungstak Sverige AB
Trädgårdsanläggningar Harry Johnson AB,5591406896,2,51,Johnsson; Rickard Valdemar,3,2,S.T.A.F:s Service Aktiebolag|Trädgårdsanläggningar Harry Johnson AB|RV Johnsson Förvaltning AB
Ventilationsservice Magnus Kristiansson           Aktiebolag,5562565449,3,51,Magnusdotter Fredriksson; Åsa C,3,5,Magnus Kristiansson Holding Aktiebolag|Ventilationsservice Magnus Kristiansson           Aktiebolag|ÅMK Holding AB
Scantec Entreprenad AB,5567104483,3,49,Amanatidis; Ioannis,1,3,Scantec Entreprenad AB
Protectum AB,5569271967,8,46,Westerbacka; Tony Mikael,5,4,Protectum AB|Låsservice i Varberg AB|Blue Man Säkerhet AB|MC Pro Säkerhet AB|WE Security AB
Brion Teknik AB,5591183461,4,43,Friberg; Johan Hans Allan,3,4,Brion Solenergi AB|Brion Teknik Fyrbodal AB|Brion Teknik AB
Walter Hansson Handel & Service AB,5567629166,4,57,Andersson; Hans Folke,1,0,Walter Hansson Handel & Service AB
Mätkungen AB,5568284938,3,48,Andersson; Hans Peter,4,3,Mätkungen AB|Hype Fastigheter AB|Peter och Sofi Förvaltning AB|Peter & Stefan Invest AB
Mätkungen AB,5568284938,3,48,Mai; Stefan Mattias Sverre,2,1,Peter & Stefan Invest AB|Mätkungen AB
Nybab AB,5565586772,2,53,nan,nan,nan,nan
Bygg & Mark i Norra Halland AB,5567172712,2,57,Pihl; Bengt Robert,2,4,Buera fiber ekonomisk förening|Bygg & Mark i Norra Halland AB
Tallbäcken Aktiebolag,5563787083,4,58,Bengtsson; Lars Tommy Stefan,1,1,Tallbäcken Aktiebolag
Lundby Entreprenad AB,5565924718,2,71,Lundby; Karl Mikael,9,13,NMT Bostäder AB|Lundby Entreprenad AB|Brune Kulle Fastighets AB|Bröderna Lundby Bygg AB|TechHouse of Sweden AB|Vallmovägen Fastighets AB|Lundby Holding AB|Luntor AB|Bingevägen Holding AB
Mölndals Bygg i Väst AB,5590124029,2,59,Hult; Rolf Anders,3,1,Åsa Mölndal Holding AB|Hult & Rastborg Fastigheter AB|Mölndals Bygg i Väst AB
Sköld Forsberg Byggkonsult AB,5569062697,4,45,Lukanovic; Bozo,20,2,BCAC Brf Fastighet 2 AB|Sköld Forsberg Byggkonsult AB|BCAC Lägenheter AB|Byggidé Falkenberg AB|BCAC - Hus Förvaltning AB|Sköld Forsberg Sandgatan Fastigheter AB|BCAC 3D AB|BCAC Brf Fastighet 1 AB|Sköld Forsberg Projekt AB|BCAC Brf Fastighet 4 AB|BCAC Brf Fastighet 3 AB|BCAC Brf-ägare 1 AB|Falkenbergsgruppen Fastighets AB|BCAC Brf Holding 3 AB|BCAC Brf Holding 2 AB|BCAC Brf Holding 1 AB|BCAC Brf Holding 4 AB|BCAC Brf-ägare 3 AB|BCAC Brf-ägare 2 AB|B.K. 1101 Invest AB
Link To Link AB,5569896177,4,45,Eneroth; Björn Jonas Rune,1,5,Link To Link AB
Martins Gräv Aktiebolag,5564052776,3,53,Arnudd; Anders Mikael,12,24,Mantum Holding AB|CBL Invest AB|Mantum Special AB|Mantum Entreprenad AB|Hyltebruks Transport Aktiebolag|Mantum Logistics AB|Veddige Åkeriaktiebolag|Martins Gräv Aktiebolag|Mantum Entreprenad i Sverige AB|VÅ Holding AB|Lisette Arnudd AB|Nosign Holding Aktiebolag
Västtak AB,5591756969,3,41,Nilsson; Per Anders,2,1,Västtak AB|PE-NI Holding AB
Jansson Mark Aktiebolag,5561204065,3,55,Segenmark Jansson; Eva Birgitta,4,2,Jansson Mark Aktiebolag|Olle Fälths Fastighets Aktiebolag|Badhusgatan 10 i Halmstad AB|Barometern Lokaler Handelsbolag
Jansson Mark Aktiebolag,5561204065,3,55,Jansson; Björn Herman Niklas,7,3,Halmstads stadsnät AB|Fastighetsägarna GFR AB|Jansson Mark Aktiebolag|Halmstads City Utvecklings Aktiebolag|Olle Fälths Fastighets Aktiebolag|Badhusgatan 10 i Halmstad AB|Fastighetsägarna GFR Ek. för.
SEDUNA AB,5591224133,6,45,Kronqvist; Jim Fredrik,2,2,SEDUNA AB|Green Earth AB
doowin AB,5591389092,4,34,Gauffin; Niklas Fredrik,2,1,LBAB Montage AB|doowin AB
Svensk Kylkvalitet AB,5568792294,3,40,Vesterberg; Ralf Joakim,1,3,Svensk Kylkvalitet AB
Edvardssons Måleri i Kungsbacka AB,5565333365,4,50,Jansson; Lars Johan Tommy,1,1,Edvardssons Måleri i Kungsbacka AB
MTA Bygg & Anläggning i Varberg AB,5569448003,5,52,Zryd; Lars Tommy,42,40,MACNAT Holding AB|MTA Bygg & Anläggning Halland AB|MTA Bygg & Anläggning Skåne AB|MTA Maskin AB|Halmstad Vårdboende AB|MTA Bygg & Anläggning i Varberg AB|Kävlinge Vårdboende AB|MTAF nr 6 AB|Eirhem AB|Industriförvaltning i Söndrum AB|Båstad Tuvelyckan AB|MTAF Nr 3 AB|MTAF nr 14 AB|Järnvägsvallen Fastighets AB|Båstadlyckan Fastighets AB|Båstads Communicationscenter AB|Trelleborg Vårdboende AB|MTAF nr 15 AB|Varberg Vårdboende AB|MTAF nr 9 AB|Midhem Projektutveckling AB|MatsTommyAndreas Fastighets AB|MTAF nr 1 AB|MACNAT Property AB|MTAF nr 13 AB|Tommy Zryd AB|Båstad Vårdboende AB|Falkenberg Vårdboende AB|MTAF nr 7 AB|MACNAT Property Development AB|MTAF nr 20 AB|Expressgrus i Halmstad AB|MTAF nr 10 AB|MTA Trollängen Holding AB|MTAF nr 8 AB|Mölnlycke Vårdboende AB|MTAF nr 2 AB|Krukan 5JL AB|MACNAT Construction AB|MTAF nr 12 AB|Krukan 5C AB|Mattan Johan AB
SGK Installations AB,5567510887,3,38,Bengtsson; Hans Fredrik Tobias,3,0,SGK Installations AB|MBM Förvaltning AB|GAFP Förvaltning AB
Alufasad Nordic AB,5591288567,5,50,Nilsson Helleklev; Artur Rickard,1,0,Alufasad Nordic AB
L-L Ställningar AB,5566450549,3,50,Lundin; Dan Jörgen,4,1,L-L Ställningar AB|J Lundin Entreprenad AB|L-V Ställningar AB|Jumake AB
L-L Ställningar AB,5566450549,3,50,Valsberg; Tomas Örjan,4,2,L-L Ställningar AB|J Lundin Entreprenad AB|L-V Ställningar AB|Jumake AB
SPINDEL AB,5566972914,5,42,Åström Spindel; Jan Sune Alfred,2,1,Jan Spindel Invest AB|SPINDEL AB
Nevecka AB,5590100920,3,42,Zachariasson; John Daniel,3,1,Nevecka Maskin AB|Nevecka Holding AB|Nevecka AB
Oves Golv i Falkenberg AB,5565549036,3,60,Lyrbring; Anders Christer,5,8,Golvet Göteborg Aktiebolag|Oves Golv i Falkenberg AB|Golvet Varberg AB|Golvet TVU AB|Säljmax Individ & Resultatutveckling i Göteborg AB
SANDÖ RÖR Aktiebolag,5564179488,3,42,Hildingh; Nils Martin,3,3,SANDÖ RÖR Aktiebolag|Ekås Holding AB|Ekåsbackens Fastigheter AB
Bårdéns El AB,5565644191,2,49,Karlsson; Nils Ola,4,3,Bårdéns El AB|Soltäppan Fastigheter AB|Soltäppan Fastigheter 2 AB|Soltäppan Holding AB
M. Maddison Konsult AB,5565722435,4,40,Pettersson; Helena Virginia,4,0,M. Maddison Konsult AB|LOPs Licenssvets AB|Maddison Konsult Holding AB|V.Pettersson Konsult i Halmstad AB
M. Maddison Konsult AB,5565722435,4,40,Dahlberg; Hanna Sofie,3,2,Maddison Konsult Holding AB|Tågaliden Förvaltning AB|M. Maddison Konsult AB
Pelles Plåt i Halmstad AB,5566837893,3,39,Dal Molin; Rolf Martin,1,2,Pelles Plåt i Halmstad AB
H H Rör AB,5569226607,3,49,Carlson; Carl Christer,4,3,Färg & Kakel i Varberg AB|H H Rör AB|H H Måleri i Varberg AB|CN Holding i Varberg AB
Alwiga Bygg AB,5591381891,2,37,Gasparini; John Alexander Domenico,3,1,Alwiga Bygg AB|Alwiga Produktions Aktiebolag|Alwiga Aktiebolag
MBM Betong AB,5591734412,2,64,Biel; Marcin,1,4,MBM Betong AB
Ginsthem AB,5568909963,3,41,Johansson; Per Erik Anders,5,10,Ginsthem AB|PJ Holding AB|Bostadsrättsföreningen Ekbacka 1|Bostadsrättsföreningen Ekbacka 2|Bostadsrättsföreningen Ekbacka 3
Molior Hus AB,5567552152,2,60,Kjörling; Pål Arne,3,0,Molior Hus AB|Falkenbergshus Aktiebolag|Molior Aktiebolag
Concrete Solutions Nordic AB,5591689467,4,51,Dam; Andrée Dupont,8,16,Concrete Solutions Nordic AB|Fane AB|Timmerbyn Bygg AB|Rare Projektutveckling AB|Bostadsrättsföreningen Timmerbyn Ski & Pool Lodge|Bostadsrättsföreningen Eagle's Cliff 552 -        Panorama & Pool|Bostadsrättsföreningen Lodge 872 - Panorama & Pool|Fjällprojekt Holding i Sälen AB
Concrete Solutions Nordic AB,5591689467,4,51,Nihlén; Carl Robert,10,2,Concrete Solutions Nordic AB|Borglin och Karlsson Förmedling AB|RN Byggkonsult AB|Timmerbyn Bygg AB|Borglin och Karlsson Förvaltning AB|Bostadsrättsföreningen Timmerbyn Ski & Pool Lodge|Rare Projektutveckling AB|Bostadsrättsföreningen Eagle's Cliff 552 -        Panorama & Pool|Bostadsrättsföreningen Lodge 872 - Panorama & Pool|Fjällprojekt Holding i Sälen AB
Plåtgruppen i Varberg AB,5590209051,1,37,Tholander; Bengt Ronny Magnus,3,1,Swe-Iso Gruppen AB|Byggruppen i Varberg AB|Plåtgruppen i Varberg AB
Arkitekterna Krook & Tjäder i Halmstad AB,5568582141,6,42,Hirell; Anna Sara Christina,3,2,Båstadhem AB|Arkitekterna Krook & Tjäder i Halmstad AB|FANN form och arkitektur
Särö Villabyggen Aktiebolag,5562047190,2,51,Ek; Jan-Erik Wilhelm,2,0,Särö Villabyggen Förvaltning Aktiebolag|Särö Villabyggen Aktiebolag
Kungsbacka Takservice AB,5590016183,3,37,Alverönn; Robert Jan-Åke,1,2,Kungsbacka Takservice AB
Selectric Sverige AB,5569085011,6,55,Wallerman; Johnny Mikael,3,4,Selectric Sverige AB|Paketluckan handelsbolag|Konsultkanalen i Göteborg
Oskarsberg Entreprenad AB,5567768030,5,58,Andersson; Erik Jonas,2,5,Halmstad Express Ekonomisk Förening|Oskarsberg Entreprenad AB
Massoptimering Sverige AB,5569691040,6,44,Björklund; Jan-Olof Elmer,4,4,Massoptimering Väst AB|Massoptimering Sverige AB|Vismo Sverige AB|Bromma Hills AB
Fire Mountain AB,5591148944,5,53,Alymenko; Andrii,2,3,Svojak AB|Fire Mountain AB
UB of Scandinavia AB,5566597919,2,56,Morten; Ann-Charlotte Margaretha,5,3,VB Optik AB|UB of Scandinavia AB|POM i Läjet AB|Pone AB|Boa P3 Studio Handelsbolag
Listab Bygg och Entreprenad AB,5567743470,4,50,Petersson; Jonas Sven Olof,2,2,Sven Anders gård AB|Listab Bygg och Entreprenad AB
WATT MEISTER EL AB,5568095516,2,59,Johansson; Hans Mathias,1,4,WATT MEISTER EL AB
Svenska Kraftbyggarna AB,5591637664,4,55,Pettersson; Johan Bo Mikael,4,2,Svenska Kraftmontage AB|Svenska Kraftbyggarna AB|Nätstationsfastigheter i Västerås AB|Knivsudden AB
TQI Consult Väst AB,5567881072,3,50,Larsson; Simon Peter,3,2,TQI Consult Aktiebolag|TQI Consult VVS AB|TQI Consult Väst AB
