company,id,number_of_board_memebers,average_age_board,executives,total_active_assignments,total_prev_assignments,companies
GFSOL AB,5569290876,3,57,Fritzson; Peter Ambjörn,1,7,GFSOL AB
GFSOL AB,5569290876,3,57,Fritzson; Daniel Peter Gustav,1,2,GFSOL AB
Träffs Elektriska Aktiebolag,5561488635,2,74,Johansson; Kenneth Evald,3,1,Idofix Aktiebolag|TLS teknik AB|Träffs Elektriska Aktiebolag
Fastighetsförvaltning i Motala AB,5590986849,3,46,Karlsson; Sven Thomas,5,10,Xplays AB|Studio Basement Rec/Thomas Karlsson|Fastighetsförvaltning i Motala AB|Kultur Bagen AB|Xplays Musikproduktion Handelsbolag
Fastighetsförvaltning i Motala AB,5590986849,3,46,Wall; Lena Sofie,2,1,Fastighetsförvaltning i Motala AB|Djurpensionatet i Motala
Hummelschakt AB,5568271034,2,68,Hummelgren; Karl-Olov Rune,1,2,Hummelschakt AB
Navringen Fastighets AB,5566938949,5,41,Evers; Benny Gunnar,3,6,Tube Energi Aktiebolag|RHEL-Gruppen AB|Navringen Fastighets AB
Torlamb byggkonsult AB,5591643597,2,47,Torlamb; Gunnar Kristofer,3,0,Saanum Service AB|Kinda Solenergi AB|Torlamb byggkonsult AB
Lo-Ka Comon Invest AB,5590055603,3,45,Karlsson; Ulla Christina,3,4,Lo-Ka Comon Invest AB|Kafé Kuriosa AB|Tina Karlsson Cafe å Sånt AB
Lo-Ka Comon Invest AB,5590055603,3,45,Lood; David Georg Anders,3,6,Lo-Ka Comon Invest AB|Kafé Kuriosa AB|Tina Karlsson Cafe å Sånt AB
Borensbergs Åkeri AB,5564651577,2,51,Andersson; Anders Jerry Emil,1,1,Borensbergs Åkeri AB
Spectra mark Öst AB,5591999650,2,41,Tolff; Lars Calle,2,3,Spectra Sverige AB|Spectra mark Öst AB
Fiwt AB,5590482500,3,51,Wirf; Fredrik Ingemar,2,3,Kerpator Fastighets AB|Fiwt AB
Eklund Hem-Bygg AB,5568947815,2,62,Butler; Robert Benjamin,1,2,Eklund Hem-Bygg AB
Bergs Företagstjänst AB,5591767438,2,54,Berg; Dick Richard Anders,1,1,Bergs Företagstjänst AB
AB Malfors Terapi & Byggforum,5565247698,2,50,Gustafsson; Erik Roland,2,3,Salary Sweden AB|AB Malfors Terapi & Byggforum
Mankans MC AB,5568953649,2,52,Eriksson; Veronica Birgitta Maria,1,2,Mankans MC AB
Mankans MC AB,5568953649,2,52,Eriksson; Göran Magnus,1,1,Mankans MC AB
Steisjö's måleri AB,5569355125,2,56,Steisjö; Bernt Magnus,1,2,Steisjö's måleri AB
Svenska Mark- och Anläggningsbolagen i Öst AB,5565231650,3,41,Alexandersson; Carl Christoffer,17,6,Bodén Mark & Anläggning i Mälardalen AB|Ockelbo Kabelteknik AB|Tjällmo Grävmaskiner Aktiebolag|Svenska Mark- och Anläggningsgruppen i Stockholm  AB|Tobbes Schakt AB|Svenska Mark-och Anläggningsbolagen i Syd AB|Andreasson & Lindh Entreprenad AB|Ekängen Bygg & Mark AB|Westins Maskin AB|JMR-Entreprenad AB|HJ Hydraulik Aktiebolag|Perssons Schakt i Mitt AB|Svenska Mark- och Anläggningsbolagen i Kungsbacka AB|FUTURISTAS AB|Svenska Mark- och Anläggningsbolagen i Öst AB|Svenska Mark och Anläggningsbolagen Återvinning AB|SMA Infrastruktur AB
PBKAB Byggkonsult AB,5590524608,2,49,Klitsie; Patrik Bertil,1,0,PBKAB Byggkonsult AB
Kattskär förvaltning AB,5569085847,2,59,Fredriksson; Mats Olof,5,3,Mats Fredriksson arkitektkontor AB|HMJ Förvaltning AB|Kattskär förvaltning AB|Mats Fredriksson Arkitektkontor|Krongården förvaltning AB
Bovirum konsult AB,5568428881,2,73,Söderman; Lars Kenneth,14,11,GEMFAST AB|Gropen 25 Fastighets AB|Stockholm Sprint 7 Fastighets AB|Sjöstaden Motala Fastighetsutveckling AB|Jaktvarvet 1 Fastighets AB|Vasastaden 17 Fastighets AB|Kungsholmens Fågel 12 Fastighets AB|Klappträet 6 Fastighets AB|GEMVERK AB|Bovirum konsult AB|Bigarråträdet 6 Fastighets AB|Sjöstaden Motala Mark Aktiebolag|GEMKAP AB|Iuppiter Mindre 14 Fastighets AB
CLAES ELGSTRÖM KONSULT AB,5591812259,2,58,Elgström; Claes Rune Mikael,1,2,CLAES ELGSTRÖM KONSULT AB
CLAES ELGSTRÖM KONSULT AB,5591812259,2,58,Forneman; Eva Maria,1,0,CLAES ELGSTRÖM KONSULT AB
Ullstorps Bygg- och Förvaltnings Aktiebolag,5563111201,2,75,Magnusson; Hans Karl Ingvar,1,1,Ullstorps Bygg- och Förvaltnings Aktiebolag
Forsberg Avans AB,5591568158,2,51,Forsberg; Pär Henrik Stefan,1,1,Forsberg Avans AB
IÅ Bygg & Konsult AB,5592069081,2,62,Åstrand; Lars Ingmar,1,9,IÅ Bygg & Konsult AB
Cepheus Fastighetsutveckling AB,5566711056,3,43,Frost Casselbrant; Per Michael,13,66,Bostadsrättsföreningen Mono|VestigiaHus Tallåsen AB|Pinegrove Asset Management AB|Vestigia Development AB|Pendula Invest AB|Cepheus Fastighetsutveckling AB|Cepheus Fastighetsservice AB|Alliance Svenska Holding AB|SMÖ Konsult AB|Vestigia Fastigheter AB|Cepheus Konsult AB|VestigiaHus Egendom AB|SMÖ Förvaltning AB
JTC Byggservice AB,5591132872,4,34,Cataldo Aguilar; Luis Jonathan,1,1,JTC Byggservice AB
JTC Byggservice AB,5591132872,4,34,Taivaloja; Johnny Alexander,1,1,JTC Byggservice AB
STROCON AB,5566668504,2,67,Svensson; Carl Johan Einar,1,4,STROCON AB
T.E.So - Tech & Energy Solutions AB,5592274137,2,35,Björnson; Carl Oscar Victor,2,4,T.E.So - Tech & Energy Solutions AB|T.E.So - Tech & Energy Solutions
Bisam Service AB,5591410757,2,35,Kåberg; Raoul Pontus,1,2,Bisam Service AB
TENA Bygg AB,5591788640,2,40,Maric; Nijaz,2,0,TENA Bygg AB|NM Måleri
TENA Bygg AB,5591788640,2,40,Maric; Ena,1,0,TENA Bygg AB
Kinda Rörservice AB,5569705469,2,44,Eriksson; Kenneth Jimmy,2,0,Kinda Rörservice AB|Kinda rörservice
Lily klinik AB,5591390645,2,38,Abdulmajeed; Nada,1,1,Lily klinik AB
Beamways AB,5567486518,2,57,Gustafsson; Bengt Gunnar,1,1,Beamways AB
Graze Design AB,5567850416,2,78,Sköld; Olof Björn-Åke,2,4,Graze Design AB|Björn Åke Sköld Design Aktiebolag
GDAB i Östergötland AB,5590098017,1,49,Ringborg; Mats Martin,2,1,HSB Bostadsrättsförening Brudlyckan i Norrköping|GDAB i Östergötland AB
IGV Consulting AB,5569181620,2,62,Larsson; Lars Erik Gunnar,1,0,IGV Consulting AB
Erikssongruppen i Kimstad Aktiebolag,5564056322,2,63,Eriksson; Bo Ingmar,3,7,Bygg och Industriteknik i Norrköping Aktiebolag|Kårö Fisk & Rökeri AB|Erikssongruppen i Kimstad Aktiebolag
Laimis Kacergis invest AB,5591643803,3,43,Kacergis; Laimis,1,0,Laimis Kacergis invest AB
MVES AB,5568893720,3,33,Paananen; Sebastian Mangnus,1,0,MVES AB
MVES AB,5568893720,3,33,Lennartsson; Emil Mikael Andreas,1,2,MVES AB
KL Mark & Konsult AB,5569558702,2,62,Lindberg; Kim Elisabet,2,2,HETRES AB|KL Mark & Konsult AB
El & Ljus Produktion i Norrköping Aktiebolag,5565000634,2,63,Lundh; Lars Magnus,1,3,El & Ljus Produktion i Norrköping Aktiebolag
Byggnadsfysik A. & K. Aktiebolag,5562002708,4,60,Kårfalk; Tord Göran,2,2,Ormsjötorps ek för|Byggnadsfysik A. & K. Aktiebolag
Hemmafix i Sverige AB,5568406390,2,47,Sköld; Joakim Magnus,2,1,Hemmafix i Sverige AB|Östergötlands poolservice
Börkéns FörvaltningsAktiebolag,5564799624,2,56,Börk‚n; Håkan Henrik,6,23,Sandå Norrköping AB|Nordic Wash AB|Fastighets AB Skulbacken|Bolmängens Fastighets AB|Börkéns FörvaltningsAktiebolag|Håbö Invest AB
Ringbergets konsult AB,5569804627,2,40,Thune; Ingrid Johanna Viktoria,2,1,Ringbergets konsult AB|Reigun Konsult AB
PHP Bygg AB,5590056486,2,43,Wright; Paul Philip Robert,2,0,PHP Bygg AB|PPH Fönster och Bygg
By Judita Design AB,5590916176,2,50,Appelfeldt; Judita,3,1,By Judita Design AB|Appelfeldts Måleri & Interiör AB|Colour Decor i Norrköping
YEISAB - Your Envirovision in Sweden AB,5569638371,2,43,Gustafsson; Carl Henrik Jonas,1,4,YEISAB - Your Envirovision in Sweden AB
YEISAB - Your Envirovision in Sweden AB,5569638371,2,43,Levin; Caroline Anna Birgitta,1,2,YEISAB - Your Envirovision in Sweden AB
C Retreat AB,5590788963,3,67,Sågensjö; Mats Lennart Emanuel,1,1,C Retreat AB
C Retreat AB,5590788963,3,67,Carlsson; Ulf Harry Emanuel,1,2,C Retreat AB
Utvecklings AB Wä Rö Ryttargård,5566162235,2,85,Tegler; Ingemar Ulf Gösta,3,1,Aktiebolaget Granebergs Revision|Aktiebolag Roslagskreditkassan-RCC|Utvecklings AB Wä Rö Ryttargård
Lindmark Markkonsult aktiebolag,5590833447,2,68,Lindmark; Birgit Gunvor Margareta,1,4,Lindmark Markkonsult aktiebolag
Lindmark Markkonsult aktiebolag,5590833447,2,68,Lindmark; Alf Bertil,1,4,Lindmark Markkonsult aktiebolag
Mayam i Linköping AB,5591128193,3,40,Mahmoud; M A,2,1,GLMM Kosmetik AB|Mayam i Linköping AB
Elektromontage Installation i Norrköping AB,5566992318,4,53,Nilsson; Hans Johan Erik,6,0,Joh Sjö AB|Industriautomatik Norrköping Aktiebolag|JohSjö System AB|Joh. Sjö Industri Aktiebolag|EMI Elektromontage Installation AB|Elektromontage Installation i Norrköping AB
Cuclair Arkitektur AB,5568473051,2,48,Cuclair; Vincent,1,1,Cuclair Arkitektur AB
Kullans Fönster AB,5591578462,2,47,Holmström; Mahlin Sofia,1,1,Kullans Fönster AB
Bo I Kolmården AB,5591863203,4,47,Bergqvist; Fredrik Wilhelm,8,15,Norrköping trading AB|Mejeriprodukter i Norrköping AB|Norrköping Risängen 4:8 Fastighets AB|Norrköping Strömsfors 2:2 AB|Two Arrows AB|Svenskflygreklam AB|Bo I Kolmården AB|Stomab AB
ROSP AB,5565188975,2,65,Spångberg; Roland Henrik,1,3,ROSP AB
Töreboda Fiber AB,5591392237,2,54,Björklund; David Sebastian Göran,5,0,Netwest Sweden AB|Töreboda Fiber AB|Finspång Fiber AB|Maintrac Infra AB|Riksbyggen Bostadsrättsförening Gånglåten
HALLDAN Bygg & Måleri AB,5568870207,2,56,Halldan; Raoul Folke Roine,1,2,HALLDAN Bygg & Måleri AB
HALLDAN Bygg & Måleri AB,5568870207,2,56,Hultberg; Marie Mia Elisabeth,1,1,HALLDAN Bygg & Måleri AB
Jarnborgs Isolering AB,5561568048,2,62,Jarnborg; Jan Erik Pierre,2,1,Isolerpartner AB|Jarnborgs Isolering AB
L H Måleri i Linköping AB,5566564679,2,63,Johansson; Hans Gunnar,3,6,Måleri Konsult Hans Johansson|Åhmans Måleri Aktiebolag|L H Måleri i Linköping AB
Cepheus Fastighetsservice AB,5562512698,3,43,Frost Casselbrant; Per Michael,13,66,Bostadsrättsföreningen Mono|VestigiaHus Tallåsen AB|Pinegrove Asset Management AB|Vestigia Development AB|Pendula Invest AB|Cepheus Fastighetsutveckling AB|Cepheus Fastighetsservice AB|Alliance Svenska Holding AB|SMÖ Konsult AB|Vestigia Fastigheter AB|Cepheus Konsult AB|VestigiaHus Egendom AB|SMÖ Förvaltning AB
Comena Fastigheter AB,5569866527,3,49,Koszarek; Leszek Henryk,3,3,Bobjon Holding AB|Comena Fastigheter AB|Comena AB
Comena Fastigheter AB,5569866527,3,49,Joncevski; Bobi,2,2,Bobjon Holding AB|Comena Fastigheter AB
Östgöta Rörservice AB,5590572276,2,50,Friman; Daniel Folke Gunnar,1,0,Östgöta Rörservice AB
Krupa Konsult AB,5590461876,2,48,Enhörning; Hans Albert,2,7,Krupa Konsult AB|HAE Byggteknik
Krupa Konsult AB,5590461876,2,48,Aruhn Pedersen; Marie Theresia Mila,1,1,Krupa Konsult AB
Håbö Invest AB,5590466065,2,56,Börk‚n; Håkan Emanuel,3,14,Håbö Invest AB|Börkéns FörvaltningsAktiebolag|Sandå Norrköping AB
JWJ i Linköping AB,5568519903,3,37,Wall; Jan Göran,1,4,JWJ i Linköping AB
Mård Bygg och Konstruktion AB,5590317003,4,56,Maghanoy Mård; Feliciano Onga,1,0,Mård Bygg och Konstruktion AB
Mård Bygg och Konstruktion AB,5590317003,4,56,Mård; Charlotta Malinda,1,0,Mård Bygg och Konstruktion AB
Porsgata solutions AB,5568453996,3,51,Redeborn; Jens Ola,3,1,Arfvidsons Begravningsbyrå & Juridik AB|Camilla Hansson Holding AB|Porsgata solutions AB
Idéhusen Skandinavien AB,5568097041,3,57,Eksmo; Anders Olof,5,5,East Industry Sweden AB|Ekmon AB|Ekmon Logistik AB|Idéhusen Skandinavien AB|MUSIKLANDET
Multon AB,5568073695,2,48,Ly; Nils Robert,2,4,Fhat AB|Multon AB
Byggidé Invest Europé AB,5566858923,2,61,Ahlén; Jan Håkan,16,51,Winterhouse AB|Miland Group AB|Närvärme från Berg AB|Miland Svenska AB|Area invest AB|Miland Åby AB|Sångbäcken Projekt AB|Virbus Property AB|NINE home AB|Doveslab AB|NORINVE förvaltning AB|Byggidé Invest Europé AB|Byggidé Invest Sweden AB|Miland Integrationen AB|Miland Tallboda AB|Miland Group Holding AB
Tekniska Verken Driftum AB,5568537129,3,56,Ols; Lars Peter,3,0,Tekniska verken Katrineholm Nät AB|Tekniska verken Linköping Nät AB|Tekniska Verken Driftum AB
KAJOART AB,5568095557,3,59,Josephson; Karin Ingrid,1,0,KAJOART AB
Bixia Byggvind AB,5567851208,3,55,Valent; Karl Henrik,10,8,Bixia Gryningsvind AB|Bobergs Vind AB|Hackeryd Vind AB|Herrberga Vind AB|Bixia ProWin AB|VävingeVind AB|Lagmansberga Tvåan Vind Kooperativ Ek. för.|Tekniska Verken i Linköping Vind AB|Bixia Byggvind AB|Värmlands Vind AB
Maria Holmgren AB,5590770490,3,34,Holmgren; Maria Helena,2,0,Maria Holmgren AB|Bostadsrättsföreningen Bergsmannen Mindre 10
Sandbäckens Brandskydd AB,5591914832,3,56,Mantinieks; Niclas Christer,2,2,Sandbäckens Brandskydd AB|Bostadsrättsföreningen Engelbrektsgatan 31;       Stockholm
Byggkonsult Göran Björertz AB,5568109390,3,49,Björertz; Lars Göran,1,0,Byggkonsult Göran Björertz AB
The First Drop AB,5568687908,2,52,Grederup; Hans Niclas,1,6,The First Drop AB
MHJ's Golv Aktiebolag,5565628905,2,45,Johansson; Kjell Daniel,2,4,MHJ's Golv Aktiebolag|KVM Golventreprenad i Norrköping AB
CF Projektkontroll AB,5591814479,2,34,Karlberg; Carl Fredrik,3,10,CF Projektkontroll AB|ENG Protech AB|CF ENTREPRENADBESIKTNING
CF Projektkontroll AB,5591814479,2,34,Karlberg; Sandra Elsa Maria,1,2,CF Projektkontroll AB
Björsäter Manufaktur AB,5569794109,3,65,Wiemerö; Tarmo Karl,2,2,Björsäter Manufaktur AB|Möblering i Tiden
Bipi Invest AB,5568185473,2,36,Blombäck; Lars Henrik,1,2,Bipi Invest AB
Maintrac Infra AB,5591931810,2,54,Björklund; David Sebastian Göran,5,0,Netwest Sweden AB|Töreboda Fiber AB|Finspång Fiber AB|Maintrac Infra AB|Riksbyggen Bostadsrättsförening Gånglåten
Finspång Fiber AB,5591807275,2,54,Björklund; David Sebastian Göran,5,0,Netwest Sweden AB|Töreboda Fiber AB|Finspång Fiber AB|Maintrac Infra AB|Riksbyggen Bostadsrättsförening Gånglåten
Fastighets AB Bladet,5569309932,3,49,Robertson; Ulf Henningsson,5,30,Säkra Lyft i Rimbo AB|U in Progress AB|Kerran Consult AB|Scandinavian Fastighet Nr.2 AB|Fastighets AB Bladet
Jan Lindén Consulting AB,5590357637,3,40,Lind‚n; Jan-Bertil,2,8,Bysjön Byggkonsult AB|Jan Lindén Consulting AB
Sweden Asian Properties AB,5568053408,2,59,Schelin; Ulf Mikael,5,8,Kroppa Konsult AB|Schelin El o Marinteknik Handelsbolag|Vita es AB|Sweden Asian Properties AB|Art of Living Handelsbolag
Sweden Asian Properties AB,5568053408,2,59,Cong; Nu Hoang Anh,4,6,Schelin El o Marinteknik Handelsbolag|Vita es AB|Sweden Asian Properties AB
ML Disign for lifestyle AB,5590312921,2,40,Lundquist; Merja Kyllikki,2,6,ML Disign for lifestyle AB|Luncon Sweden AB
Åhlin & Ekeroth Invest AB,5592122567,6,55,Lundström; Björn Göran,5,8,Åhlin & Ekeroth AB|Åhlin & Ekeroth Byggnads AB|Tillväxt Motala AB|Haga Vadstena AB|Åhlin & Ekeroth Invest AB
Sandbäckens Rör i Lund AB,5591914840,4,47,Johansson; Stefan Ulf,1,0,Sandbäckens Rör i Lund AB
ByggPartner i Dalarna Holding AB (publ),5567109243,5,65,Leo; Jan Fredrik,8,3,ByggPartner i Dalarna Holding AB (publ)|Bygg Partner i Dalarna Aktiebolag|ByggPartner i Dalarna Service AB|JUF Byggnadsställningar Aktiebolag|BOL Projekt AB|Fastighetsaktiebolaget Lärarinnan Holding i Borlänge|ByggPartner i Dalarna Fastighets AB|Fastighetsaktiebolaget Lärarinnan Södra i Borlänge
Bygg Partner i Dalarna Aktiebolag,5565319984,5,65,Leo; Jan Fredrik,8,3,ByggPartner i Dalarna Holding AB (publ)|Bygg Partner i Dalarna Aktiebolag|ByggPartner i Dalarna Service AB|JUF Byggnadsställningar Aktiebolag|BOL Projekt AB|Fastighetsaktiebolaget Lärarinnan Holding i Borlänge|ByggPartner i Dalarna Fastighets AB|Fastighetsaktiebolaget Lärarinnan Södra i Borlänge
HMB Construction AB,5564830957,4,49,Karlsson; Karl Krister,9,23,HMB Construction AB|SWE Maskinrenting AB|HMB Construction Örebro AB|Lillskär Invest 7 AB|Hundala Holding AB|HMB Holding AB|HMB Falun AB|Lillskär Kasernhus 4 Strängnäs AB|HMB Strängnäs AB
Mockfjärds Fönster AB,5565195723,4,54,Andersson; Mattias Sven Bertil,1,7,Mockfjärds Fönster AB
Österling Bygg Aktiebolag,5564740164,4,57,Malmfors; Niklas Gunnar,2,1,Österling Bygg Aktiebolag|NM Consulting
Byggnadsingenjör Nils Skoglund Aktiebolag,5562365568,6,53,Skoglund; Per Mattias,17,27,Grönklittsgruppen AB (publ)|Byggnadsingenjör Nils Skoglund Aktiebolag|Fastighetsbolaget Nils Skoglund Aktiebolag|Aktiebolag Mora Byggservice|Hjultorget Aktiebolag|Leksands Maskinpartner AB|Nils Skoglund Måleri AB|SkiLodge Tänndalen AB|Cinderstone i Falun Fastighets AB|Fastigheten Leksand Övre Heden 13:13 AB|Fastigheten Rickomberga 10:4 AB|Nils Skoglund Byggmaskiner Aktiebolag|Nils Skoglund Invest AB|Bostadsrättsföreningen Hesseborns i Leksand|Bostadsrättsföreningen Jupiter 1 i Idre|Bostadsrättsföreningen Jupiter 2 i Idre|Bostadsrättsföreningen Nygård 3 i Leksand
Scanmast AB,5567755938,7,53,Andersson; Ann-Charlotte Maria J,3,18,Fagerströmbolagen AB|Scanmast AB|Scanhold AB
DALAB Sverige AB,5566389929,7,55,Ekgren; Hans Henrik,7,5,DALAB Sverige AB|Milen Ventilation AB|Tunabygdens VVS-Installatör AB|Henningssons Elektriska Aktiebolag|Henningsons El Service Aktiebolag|Säters Golf AB|HEIKAB Installationskonsult AB
Svenska Tungdykargruppen AB,5567395529,2,41,Eriksson; Johan Erik,10,5,Svenska Tungdykargruppen AB|RCSA Products AB|HighWater Invest AB|Mora Sjöcafé AB|Mjödner AB|Johan Eriksson Consulting|Grassor AB|High Water Marine Solutions i Gesunda AB|Highwater Group AB|Highwater Invest i Gesunda Group AB
Byggarna i Falun Mikael Lusth AB,5566604509,2,43,Lust; Thore Mikael,6,7,Byggarna i Falun Mikael Lusth AB|Mikael Lusth Förvaltnings AB|Täkten i Falun Fastighets Aktiebolag|Martisa AB|Stall Zedendahl AB|Bostadsrättsföreningen Byggarnahus nummer 1
Aktiebolaget Grytnäs Gräv,5562896943,3,66,Bohman; Leif Magnus,4,1,Aktiebolaget Grytnäs Gräv|Grytnäsbolagen Aktiebolag|Grytnäs Leasing AB|Grytnäs Förvaltning AB
AEB Anläggningsentreprenader AB,5563449437,3,62,Blomberg; Sune Thomas,2,17,AEB Anläggningsentreprenader AB|Ludvika Lastbilcentral AB
Grytnäs Projekt AB,5563817088,7,54,Svenman; Jan Niclas,1,2,Grytnäs Projekt AB
Grytnäs Projekt AB,5563817088,7,54,Mattsson; Maria Kristina,2,4,Grytnäs Projekt AB|GP Förvaltning i Falun AB
Vatten & Avfall i Malung-Sälen AB,5568646284,10,56,Larsson; Ingeborgs Dan Stefan,1,5,Vatten & Avfall i Malung-Sälen AB
Selek Elentreprenad AB,5565046876,5,46,Gärd; Sven Jonas Robert,6,1,M.E. Solutions AB|Selek Elentreprenad AB|Söderhamns El/styrteknik AB|Selek Fastigheter AB|Svensk Elentreprenad & Invest AB|Jonas Gärd AB
Selek Elentreprenad AB,5565046876,5,46,Herou; Carl Pontus,11,11,Selek Elentreprenad AB|Söderhamns El/styrteknik AB|Heroutech Consulting AB|Herou Beauty AB|Selek Fastigheter AB|Norrvik Invest AB|Folkärna Fiber Ekonomisk förening|Svensk Elentreprenad & Invest AB|Naturlig tillväxt NUTAB Aktiebolag|Heroutech Enterprice AB|Jonas Gärd AB
ByggTjänst i Falun AB,5566230974,2,50,Fyhr; Anders,2,2,ByggTjänst i Falun AB|Fastighets AB Riset 5
Soil Mixing Group AB,5590011606,5,54,Persson; Henrik Arne,4,2,Soil Mixing Group AB|Soil Mixing Group Maskin AB|Soil Mixing Group Holding AB
Tunabygdens VVS-Installatör AB,5566280623,7,53,Ekgren; Hans Henrik,7,5,DALAB Sverige AB|Milen Ventilation AB|Tunabygdens VVS-Installatör AB|Henningssons Elektriska Aktiebolag|Henningsons El Service Aktiebolag|Säters Golf AB|HEIKAB Installationskonsult AB
Mora Bygg AB,5568401425,4,47,Holmin; John Anders Mattias,3,0,Mora Bygg AB|Helob Bygg AB|Mora Golv & Kakel AB
Miljönären Måleri AB,5565975876,3,54,Söderqvist; Frans Andreas,7,9,Promål AB|Miljönären Måleri AB|Miljönären Golv AB|Miljönären Måleri Entreprenad AB|Miljönären Lebe Golv AB|Miljönären Resurs AB|Miljönären Franschise AB
MyVi AB,5568803216,4,54,Pers; Jan Olof,6,8,MyVi AB|MyVi Digital Projekthantering AB|MyVi Konsult Mitt AB|MyVi Datasamordning AB|Myckelby Infrateknik AB|MyVi Holding AB
Hedemora Kraft och Värme AB,5565279626,4,62,Engdahl; Anders Rune,7,8,Hedemora Energi Aktiebolag|Hedemora Kraft och Värme AB|Hedemora Elnät AB|Omvårdnad i Skönvik Aktiebolag|Svältbackens Kraft Aktiebolag|Förvaltning i Skönvik Aktiebolag|Hedemora Elhandel AB
Scandinavian Roadconstruction AB,5567976252,3,62,Martinsson; Per Göran,5,18,Scandinavian Roadconstruction AB|Dala Väg AB|Scandinavian Road and Infrastructure AB|Dalabygdens Mark & Bygg Aktiebolag|Falu Export & Trading AB
Rönnberg & Mattsson Bygg Aktiebolag,5563591758,4,57,Rönnberg; Erik Torbjörn,7,5,Rönnberg & Mattsson Bygg Aktiebolag|Norbergs Bygg & Inredning AB|Högåsa Företagspartner AB|Restaureringsmasarna Bygg AB|Södra Dalarnas Tillväxtkassa AB|Åke Höglunds Måleri Aktiebolag|Engsbergs Holding AB
Ludvika Lastbilcentral AB,5566053889,3,62,Blomberg; Sune Thomas,2,17,AEB Anläggningsentreprenader AB|Ludvika Lastbilcentral AB
DalaFrakt Entreprenad AB,5563081057,9,57,Mattsson; Peter Johan,5,0,DalaFrakt AB|DalaFrakt Entreprenad AB|Dala Frakt Produktion AB|DalaFrakt Förvaltning AB|Bostadsrättsföreningen Fröja
Signalbolaget i Sverige AB,5567075543,4,51,Selin; Olga,5,8,Signalbolaget Holding AB|Signalbolaget i Sverige AB|Svensk spårbesiktning AB|Sveriges Järnvägsentreprenörer AB|Borlänge Tennisklubb
Signalbolaget i Sverige AB,5567075543,4,51,Andersson; Ulf Henrik,3,7,Svensk spårbesiktning AB|Signalbolaget Holding AB|Signalbolaget i Sverige AB
Smedjebacken Energi AB,5562234566,16,59,Ferner Kny; Eva Cia,3,8,Smedjebacken Energi AB|Bärkehus Aktiebolag|Smedjebacken Energi Nät Aktiebolag
Sundahem Sverige AB,5591023410,2,54,Katainen; Ismo Heikki Ilari,2,1,Sundahem Sverige AB|Kinnunen & Katainen AB
Rallarsving AB,5590523576,4,53,Sjöblom; Karl Leif Tomas,4,50,Rallarsving AB|Raildoc AB|Hobby Entreprenad Borlänge AB|Föräldrakooperativet i Halvarsgårdarna            ek förening
Rallarsving AB,5590523576,4,53,Karström; Johan,4,3,Rallarsving AB|Nordic Rent and Event AB|JLW Invest AB|Nordic Entreprenad i Ånge AB
Rustabo Sverige AB,5591166060,2,49,Hafvsdalen; Tommy Kent Gustav,13,17,Hancap AB (publ)|Westcoast Windows AB|Lugnet i Falun AB|Älvdalens Utbildningscentrum AB|Rustabo Sverige AB|AB Dalaflyget|Gårdsmark Sverige AB|AB Kandre International|Kompetens Resurs i Sverige AB|Comtranco Management Consulting AB|Fönsterbytarna Skandinavien AB|Hafvsdalen Holding AB|Dalarna Beyond Digitalization ekonomisk förening
Swe Dala Tak AB,5568143415,2,44,Camitz; Erik Henrik,6,17,Swe Dala Tak AB|Swe Dala Tak Försäljning AB|Starmitz invest AB|Takmästarna i norr AB|Takmästarna i väst AB|Takmästarna i öst AB
Dalakranar AB,5564533973,4,50,Ax; Lars Anders Yngve,1,2,Dalakranar AB
Nordsign Aktiebolag,5566992706,3,49,Asp; Erik Christian,4,4,Nordsign Aktiebolag|Möttönen och Asp Holding AB|Erik Asp Holding AB|ARE Noret AB
Nyman Jansson Bygg AB,5566230982,3,51,Höök; Pär Bertil,3,2,Lodwija AB|Nyman Jansson Bygg AB|Elin Ek Friskvård AB
Dalarnas Infraentreprenad AB,5563207546,4,52,Bjurell; Per Anders,8,4,Dalarnas Infraentreprenad AB|Hyttings Industrifastighet Aktiebolag|Dala Infrakonsult i Sverige AB|Göran Bjurell Consulting AB|Hytting Invest AB|Tronsjö Holding AB|Hytting Holding AB|Dala Infrastructure AB
Lunds Schakt & Planering i Borlänge Aktiebolag,5561140202,3,55,Lund; Lars Åke,4,1,Lunds Schakt & Planering i Borlänge Aktiebolag|Lund Content AB|Kondens Studios AB|Konsultlund AB
SRR INFRATEKNIK AB,5569436057,3,41,Jonsson; Jens Arne,3,7,Streamfield AB|JJO Musik|SRR INFRATEKNIK AB
Miljönären Golv AB,5561883371,2,54,Söderqvist; Frans Andreas,7,9,Promål AB|Miljönären Måleri AB|Miljönären Golv AB|Miljönären Måleri Entreprenad AB|Miljönären Lebe Golv AB|Miljönären Resurs AB|Miljönären Franschise AB
Markgruppen i Dalarna Aktiebolag,5565027454,4,51,Kandell; Lars Magnus,2,1,Bergdell AB|Markgruppen i Dalarna Aktiebolag
Näséns Byggnadsaktiebolag,5560644741,2,42,Näsén; Lars Håkan,2,1,Bostadsrättsförening Flottaren|Näséns Byggnadsaktiebolag
HIAK AB,5561797001,2,54,Hongisto; Maria Kristina,1,1,HIAK AB
Norrdala Bygg AB,5591563530,3,33,Johansson; Leif Pontus,5,3,Norrdala Bygg AB|Älvdalsgruppen AB|Askebyn i Idre AB|Norrdala Fastigheter AB|PWJ Invest AB
ScandRail Sweden AB,5566728589,1,65,Hammarbäck; Karl Ernst Jörgen,3,1,ScandRail Sweden Holding AB|Nordic Rail Control and Competence AB|ScandRail Sweden AB
Norbergs Bygg & Inredning AB,5565755690,4,57,Rönnberg; Erik Torbjörn,7,5,Rönnberg & Mattsson Bygg Aktiebolag|Norbergs Bygg & Inredning AB|Högåsa Företagspartner AB|Restaureringsmasarna Bygg AB|Södra Dalarnas Tillväxtkassa AB|Åke Höglunds Måleri Aktiebolag|Engsbergs Holding AB
Ludvika El-Installation Aktiebolag,5561831719,3,58,Persson; Jan Gösta,3,9,Vansbro Elektriska Installations Aktiebolag|Ludvika El-Installation Aktiebolag|Ludvika El-Fastighets AB
T&B Broproduktion AB,5591920920,4,46,Tranberg; Per Henrik,3,0,Hallsta 1:21 AB|T&B Broproduktion AB|HT Tranberg AB
R Eks Plåt & Vent. Service Aktiebolag,5565211678,3,61,Ek; Lars Ture Roger,4,8,R Eks Plåt & Vent. Service Aktiebolag|Zmide i Krylbo AB|R. Eks Fastigheter AB|R. Eks Holding AB
VOID AB,5566590005,3,43,Karlsson; Per Arne,10,5,Concrete Demolition Förvaltning AB|Arnessons Betongborrning AB|VOID AB|Karlskoga Betongdemolering AB|Arnessons Service AB|Fryxta Entreprenad AB|Nordvärmlands Bygg AB|Lekana Aktiebolag|Gunnarstugan AB|Fryxta Fastigheter AB
Structor Projektledning Dalarna AB,5566548698,6,52,Hansson; Allan Mikael,1,0,Structor Projektledning Dalarna AB
Vattenhuset i Borlänge AB,5560445222,3,49,Norman; Per Emil,8,6,Vattenhuset i Borlänge AB|Borrföretagen i Sverige ekonomisk förening|Borrföretagen Service i Sverige AB|Norman Byggmästaren 4 AB|Svenskt Geoenergicentrum AB|Per Norman Investment AB|Vattenhuset i Älvdalen AB|BanasCo Invest AB
Vansbro Elektriska Installations Aktiebolag,5560545500,3,56,Johannesson; Hi Lars Åke,3,4,Vansbro Elektriska Installations Aktiebolag|Bältarbo fiberförening ekonomisk förening|Firma Lars Johannesson
Swe Dala Tak Försäljning AB,5591390967,6,52,Puzia Bergkvist; Teresa Elisabeth,4,3,Swe Dala Tak Försäljning AB|Takmästarna i öst AB|Takmästarna i väst AB|Takmästarna i norr AB
Nordic Trackservice i Norden AB,5569398364,3,42,Alm; Jarl Victor,4,6,Nordic Trackservice i Norden AB|Infralink i Sverige AB|Alm Victor IC AB|Torsångs Konsulttjänst AB
